{
  "contract_version": "2.0.0",
  "protocol_id": "FT-013A-TEMPLATE-001",
  "status": "planned",
  "execution_confirmed": false,
  "recommendation_blocked": true,
  "base_case": {
    "schema_version": "2.0.0",
    "composition": "Co",
    "active_family": "Co",
    "active_phase_hypothesis": "Co0 a confirmar",
    "support": "Al2O3",
    "active_metal_loading_wt_pct": 20,
    "promoter": "Ru",
    "promoter_loading_wt_pct": 0.5,
    "precursor": "precursor registrado no caso de origem",
    "activation_gas": "H2",
    "activation_temperature_c": 400,
    "activation_duration_h": 10,
    "reactor_type": "leito fixo",
    "bed_inlet_temperature_c": 220,
    "bed_outlet_temperature_c": 220,
    "temperature_c": 220,
    "pressure_bar": 20,
    "h2_co_molar_ratio": 2,
    "feed_composition_mol_fraction": {"H2": 0.6666666667, "CO": 0.3333333333},
    "feed_flow_mol_s": 0.001,
    "ghsv_h_1": 500,
    "whsv_h_1": null,
    "catalyst_mass_g": null,
    "bed_volume_ml": 1,
    "time_on_stream_h": 24,
    "analytical_method": "método a confirmar",
    "replicate_count": 3,
    "steady_state_criterion": "critério a confirmar",
    "desired_product": "C12-C20",
    "ft_regime": "LTFT",
    "regime_envelope_version": "1.0.0",
    "regime_justification": null
  },
  "reactor_configuration": {
    "internal_diameter_mm": null,
    "heated_length_mm": null,
    "bed_porosity_fraction": null,
    "catalyst_particle_diameter_um": null,
    "catalyst_mass_g": null,
    "inert_diluent": null,
    "dilution_ratio_mass": null,
    "diluent_particle_diameter_um": null
  },
  "activation_protocol": {
    "gas_composition_mol_fraction": null,
    "total_flow_mol_s": null,
    "temperature_c": null,
    "heating_rate_c_min": null,
    "hold_time_h": null,
    "pressure_bar": null
  },
  "analytics": {
    "online_detectors": null,
    "species_ranges": null,
    "calibration_protocol": null,
    "detection_limits": null,
    "quantification_limits": null,
    "heavy_fraction_method": null,
    "heavy_fraction_recovery_pct": null
  },
  "source_ids": ["synthetic-template-not-experimental-evidence"],
  "field_sources": {}
}
